<xs:schema elementFormDefault="qualified" xmlns:xs="http://www.w3.org/2001/XMLSchema">
    <xs:element name="document">
        <xs:complexType>
            <xs:sequence>
                <xs:element name="data">
                    <xs:complexType>
                        <xs:sequence>
                            <xs:element name="rows">
                                <xs:complexType>
                                    <xs:sequence>
                                        <xs:element name="row" maxOccurs="unbounded" minOccurs="1">
                                            <xs:complexType>
                                                <xs:simpleContent>
                                                    <xs:extension base="xs:string">
                                                        <xs:attribute type="xs:string" name="secid" use="required"/>
                                                        <xs:attribute type="xs:string" name="name" use="required"/>
                                                        <xs:attribute type="xs:string" name="regnumber" use="required"/>
                                                        <xs:attribute type="xs:string" name="emitent_title" use="required"/>
                                                    </xs:extension>
                                                </xs:simpleContent>
                                            </xs:complexType>
                                        </xs:element>
                                    </xs:sequence>
                                </xs:complexType>
                            </xs:element>
                        </xs:sequence>
                        <xs:attribute type="xs:string" name="id" fixed="securities"/>
                    </xs:complexType>
                </xs:element>
            </xs:sequence>
        </xs:complexType>
    </xs:element>
</xs:schema>